{
  "schema_version": 1,
  "id": "CB-GD-002",
  "name": "Opto-compatible isolated driver with steering-diode turn-off path",
  "category": "gate_drivers",
  "function": "Single-output isolated driver where turn-on uses R_ON alone and turn-off uses R_ON in parallel with a diode-steered R_OFF branch, plus local source-referenced decoupling and an optional Miller-clamp connection.",
  "inputs": [
    {
      "name": "ANODE / CATHODE",
      "description": "e-diode PWM input driven through series resistors",
      "domain": "control",
      "range": "opto-compatible current input"
    },
    {
      "name": "VDD2 / SOURCE / VSS2",
      "description": "isolated +15 / 0 / -3.3 V rails",
      "domain": "isolated-driver"
    }
  ],
  "outputs": [
    {
      "name": "GATE",
      "description": "gate through R6 (on) and R6 || (R7 + D3) (off)",
      "domain": "isolated-driver"
    },
    {
      "name": "SOURCE",
      "description": "Kelvin-source return",
      "domain": "isolated-driver"
    },
    {
      "name": "CLAMP",
      "description": "optional Miller clamp pin to the gate",
      "domain": "isolated-driver"
    }
  ],
  "operating_conditions": [
    "Discrete SiC MOSFETs on evaluation fixtures; 0-50 degC board operating range (CGD15SG00D2)."
  ],
  "required_components": [
    {
      "role": "isolated driver",
      "value_or_part": "UCC23514MDWVR",
      "source_refdes": "U1",
      "component": "CMP-UCC23514"
    },
    {
      "role": "input resistors",
      "value_or_part": "2 x 510 ohm 0805",
      "source_refdes": "R1, R2"
    },
    {
      "role": "turn-on resistor",
      "value_or_part": "10 ohm MELF 0207 0.4 W",
      "source_refdes": "R6"
    },
    {
      "role": "turn-off branch resistor",
      "value_or_part": "10 ohm MELF 0207",
      "source_refdes": "R7"
    },
    {
      "role": "steering Schottky",
      "value_or_part": "1N5819HW-7-F, cathode toward driver VOUT",
      "source_refdes": "D3"
    },
    {
      "role": "gate pull-down",
      "value_or_part": "47 kOhm",
      "source_refdes": "R8"
    },
    {
      "role": "source-referenced decoupling",
      "value_or_part": "10 nF + 100 nF + 4.7 uF SOURCE to VSS2",
      "source_refdes": "C10, C11, C12"
    }
  ],
  "design_calculations": [
    {
      "name": "Equivalent resistances",
      "expression": "R_on = R6; R_off ~ R6 || (R7 + r_D) with diode drop limiting the branch near the end of turn-off",
      "basis": "CGD15SG00D2 schematic sheet 1; PRD-09301 §3.2 Fig.24(c)",
      "example": "10 ohm on, ~5 ohm off",
      "check": "EC-009"
    }
  ],
  "interface_requirements": [
    "Opto-style input: provide sufficient e-diode forward current from the PWM source.",
    "Rails generated by an isolated bias such as CB-IS-001."
  ],
  "pcb_constraints": [
    "Steering diode and both resistors close to the driver output and the gate connector.",
    "Source-referenced decoupling capacitors very close to the output source pin (PRD-08391 p.10-11).",
    "Diode orientation must be verified against the footprint pin map; the netlist cannot show polarity."
  ],
  "source_designs": [
    {
      "reference": "REF-WS-CGD15SG00D2",
      "refdes": "U1, R6, R7, D3, R8, C9-C12",
      "evidence": [
        {
          "source": "REF-WS-CGD15SG00D2",
          "document": "CGD15SG00D2-SCH",
          "location": "sheet 1",
          "kind": "observed"
        },
        {
          "source": "REF-WS-CGD15SG00D2",
          "document": "CGD15SG00D2-ALL",
          "location": "ODB++ eda/data",
          "kind": "netlist",
          "check": "EC-025"
        },
        {
          "source": "REF-WS-CGD15SG00D2",
          "document": "PRD-08391",
          "location": "Schematic and Functionality",
          "kind": "stated"
        }
      ]
    }
  ],
  "validation_status": "analytically-checked",
  "validation_notes": "Connectivity confirmed from ODB++ (EC-025) and diode orientation from the schematic symbol; equivalent resistances computed (EC-009). No switching tests by AIPE.",
  "limitations": [
    "No overcurrent protection in this block.",
    "Diode recovery and forward drop affect low-resistance tuning."
  ],
  "alternatives": [
    {
      "approach": "Driver IC with separate OUTH/OUTL pins (CB-GD-001)",
      "trade_off": "No steering diode needed; requires a split-output driver.",
      "evidence": [
        {
          "source": "REF-WS-CGD1700HB2M-UNA",
          "document": "PRD-09301",
          "location": "§3.2 Figure 24(a)",
          "kind": "stated"
        }
      ]
    },
    {
      "approach": "Two steering diodes fully decoupling R_ON and R_OFF",
      "trade_off": "Fully independent values; one more diode in the gate loop.",
      "evidence": [
        {
          "source": "REF-WS-CGD1700HB2M-UNA",
          "document": "PRD-09301",
          "location": "§3.2 Figure 24(b)",
          "kind": "stated"
        }
      ]
    }
  ],
  "keywords": [
    "steering diode",
    "turn-off resistor",
    "opto-compatible",
    "gate driver"
  ],
  "related": {
    "components": [
      "CMP-UCC23514"
    ],
    "skills": [
      "SKILL-001"
    ],
    "rules": [
      "KR-GD-002",
      "KR-GD-003"
    ]
  }
}
